{
  "schema": "pokemon-autochess-character-capture-spec-v1",
  "capture_id": "sv-eevee-modern-surface-v1",
  "status": "planned",
  "purpose": "Complement the emulator-free Scarlet/Violet Eevee shader analysis with runtime-only SSS, AO, EyeClearCoat, point-light, environment, mip/sampler, and final-color evidence if a controlled source program later becomes available.",
  "source": {
    "game": "Pokemon Scarlet",
    "version": "3.0.1",
    "title_id": "0100A3D008C5C000",
    "content_identity": "pokemon-scarlet-v3.0.1",
    "executable_sha256": null,
    "notes": "The verified merged RomFS is retained locally. Static analysis has selected and decompiled the exact Eevee SSS and EyeClearCoat programs without launching a game. A launchable source-game program/content image has not been identified, so this optional runtime specification remains planned."
  },
  "subject": {
    "species_id": 133,
    "species_name": "Eevee",
    "form": "Kanto base form",
    "gender": "male/default geometry",
    "appearance": "regular",
    "source_resource": "romfs/pokemon/data/pm0133/pm0133_00_00"
  },
  "canonical_model": {
    "stem": "0133_Eevee_SV",
    "manifest": "assets/models/0133_Eevee_SV.phmodel",
    "source_model_sha256": "c564f8270b40c90c544ac689b893c682868422171d32bd201a87631789045c36",
    "payload_sha256": "4bfc97d56b81390e481bc8ec196c0fbc44dd549a9334cd4893e3605102428eca",
    "expected_shader_families": ["EyeClearCoat", "SSS"],
    "expected_materials": ["body_a", "body_b_02", "l_eye", "r_eye"]
  },
  "capture_environment": {
    "api": "Vulkan",
    "emulator": {
      "name": "Eden",
      "version": "0.2.1",
      "executable": "D:/DevTools/Emulators/Eden/eden.exe",
      "executable_sha256": "c4135c90e5dca07bfc629081ddfc316ad35ebe6095e54854706c61b41e98a97c"
    },
    "renderdoc": {
      "version": "1.45",
      "executable": "D:/DevTools/RenderDoc/1.45/renderdoccmd.exe",
      "executable_sha256": "273352017e23e890fe9134de0157d1fe556676a4c6004bfe3265db1a4648ed07"
    },
    "display": {
      "width": null,
      "height": null,
      "mode": "unknown",
      "scale": null
    },
    "game_state": {
      "location": null,
      "weather": null,
      "time_of_day": null,
      "camera": null,
      "lighting": null,
      "notes": "Record exact source location, camera, weather, time, exposure-relevant state, and display mode before the first capture. Prefer a repeatable inspection or battle context with one clearly visible Eevee."
    }
  },
  "states": [
    {
      "id": "regular_neutral_front",
      "required": true,
      "appearance": "regular",
      "animation": {
        "clip": "pm0133_00_00_00000_defaultwait01_loop",
        "source_frame": 0,
        "loop": true,
        "notes": "Baseline body, fur and open-eye material state."
      },
      "source_setup": {
        "lighting": "Neutral predominantly frontal source light; record all bound light buffers rather than estimating the direction from the image.",
        "environment": "Documented stable source environment without weather transitions.",
        "camera": "Front three-quarter framing with the entire Eevee visible and enough pixels for fur-detail inspection.",
        "notes": "The exact game setup is unresolved until the launchable source build is available."
      },
      "capture": {
        "status": "planned",
        "rdc_file": null,
        "rdc_sha256": null,
        "frame_number": null,
        "pokemon_event_ids": [],
        "notes": "Do not populate until the immutable protected RDC and Eevee draw events are verified."
      }
    },
    {
      "id": "regular_grazing_light",
      "required": true,
      "appearance": "regular",
      "animation": {
        "clip": "pm0133_00_00_00000_defaultwait01_loop",
        "source_frame": 0,
        "loop": true,
        "notes": "Expose directional roughness, fibre breakup, clear coat and silhouette response."
      },
      "source_setup": {
        "lighting": "Source light at a grazing angle across the head, neck fur, body and tail; record the actual light buffers.",
        "environment": "Same environment and post-processing state as regular_neutral_front.",
        "camera": "Same framing and projection as regular_neutral_front where possible.",
        "notes": "If gameplay cannot hold a light while keeping camera/pose fixed, capture a documented contiguous sequence and solve the light/camera transforms from buffers."
      },
      "capture": {
        "status": "planned",
        "rdc_file": null,
        "rdc_sha256": null,
        "frame_number": null,
        "pokemon_event_ids": [],
        "notes": "Planned source evidence."
      }
    },
    {
      "id": "regular_dark_environment",
      "required": true,
      "appearance": "regular",
      "animation": {
        "clip": "pm0133_00_00_00000_defaultwait01_loop",
        "source_frame": 0,
        "loop": true,
        "notes": "Separate ambient, local reflection, additional-light and subsurface contributions."
      },
      "source_setup": {
        "lighting": "Low-key source lighting with one readable key and recorded environment/reflection resources.",
        "environment": "Documented dark source environment with stable weather and exposure.",
        "camera": "Match the baseline view as closely as gameplay permits.",
        "notes": "Do not infer darkness from a screenshot alone; preserve exposure and post-process buffers."
      },
      "capture": {
        "status": "planned",
        "rdc_file": null,
        "rdc_sha256": null,
        "frame_number": null,
        "pokemon_event_ids": [],
        "notes": "Planned source evidence."
      }
    },
    {
      "id": "regular_eye_blink",
      "required": true,
      "appearance": "regular",
      "animation": {
        "clip": "pm0133_00_00_08000_eye01",
        "source_frame": 10,
        "loop": false,
        "notes": "Capture the dedicated eye animation near its midpoint; confirm the exact visible blink frame from the source before promotion."
      },
      "source_setup": {
        "lighting": "Reuse the neutral baseline lighting.",
        "environment": "Reuse the neutral baseline environment.",
        "camera": "Closer head framing is allowed if the camera and projection are recorded.",
        "notes": "Needed to distinguish eye-atlas, skeletal eyelid, point-light and clear-coat behavior."
      },
      "capture": {
        "status": "planned",
        "rdc_file": null,
        "rdc_sha256": null,
        "frame_number": null,
        "pokemon_event_ids": [],
        "notes": "Planned source evidence."
      }
    },
    {
      "id": "shiny_neutral_front",
      "required": true,
      "appearance": "shiny",
      "animation": {
        "clip": "pm0133_00_00_00000_defaultwait01_loop",
        "source_frame": 0,
        "loop": true,
        "notes": "Verify that the material equations remain stable while the rare palette changes."
      },
      "source_setup": {
        "lighting": "Match regular_neutral_front.",
        "environment": "Match regular_neutral_front.",
        "camera": "Match regular_neutral_front.",
        "notes": "Use a legitimate shiny source state and record how it was established."
      },
      "capture": {
        "status": "planned",
        "rdc_file": null,
        "rdc_sha256": null,
        "frame_number": null,
        "pokemon_event_ids": [],
        "notes": "Planned source evidence."
      }
    }
  ],
  "required_evidence": [
    "rdc_capture",
    "draw_inventory",
    "selected_draw_pipeline_state",
    "vertex_shader_disassembly",
    "fragment_shader_disassembly",
    "descriptor_and_texture_bindings",
    "sampler_states",
    "uniform_and_constant_buffers",
    "blend_depth_stencil_cull_state",
    "lighting_environment_reflection_resources",
    "source_color_target",
    "fixed_setup_metadata"
  ],
  "evidence": {
    "artifacts": [],
    "open_questions": [
      {
        "id": "sss_diffusion_equation",
        "status": "open",
        "question": "How do the anonymous constant-buffer fields in exact SSS variation 56 map to SSSMaskScale/Offset, SubsurfaceColor, and source light terms? The SSSMaskMap texture binding itself is now proven as tcb_1A.x.",
        "evidence_needed": ["offline_shader_data_flow", "named_constant_layout", "uniform_and_constant_buffers", "controlled_light_states"],
        "answer": null
      },
      {
        "id": "directional_fibre_semantics",
        "status": "answered",
        "question": "Is RoughnessMap a scalar roughness input or a dedicated anisotropy/fibre-direction input in Eevee's selected SV SSS program?",
        "evidence_needed": ["exact_shader_variation", "offline_fragment_disassembly", "material_texture_roles"],
        "answer": "Exact SSS variation 56 samples the enabled RoughnessMap through one scalar channel. No dedicated flow or two-component fibre-direction texture is present. The atlas contains high-resolution surface structure, but Phlosion's additional fibre relief/sheen is a visual reconstruction rather than a source-proven directional lobe."
      },
      {
        "id": "eye_clearcoat_final",
        "status": "open",
        "question": "How do the unresolved retained BaseColorMap/LayerMaskMap/NormalMap path, projected tcb_3E.x scene resource, PointLightIndex, shadow/environment resources, and now-mapped EyeClearCoat constants produce the final response? NormalMap1=tcb_1E.xy, BaseColorMap1=tcb_1A.xyz, the directly used clear-coat/highlight constants, and the lack of a highlight texture binding are already proven.",
        "evidence_needed": ["eye_draw_events", "fragment_shader_disassembly", "point_light_buffer", "neutral_and_blink_states"],
        "answer": null
      },
      {
        "id": "additional_light_and_environment",
        "status": "open",
        "question": "Which additional-light, ambient, reflection and post-process resources materially affect Eevee's perceived fur and gloss?",